{
  "schema": "adventures.visual_sidecar.adjacent.v1",
  "project": "Adventures of Patch",
  "character": "Klause",
  "sidecar_purpose": "Repo-resident semantic image sidecar for Codex/Devin worker selection, visual continuity, QA, and prompt constraint extraction.",
  "source_truth_note": "This sidecar is derived visual evidence for the referenced image. It does not by itself promote the image to canon beyond the acceptance state stated here.",
  "runtime_use_note": "Use this sidecar for ordinary textual selection and continuity work. Inspect the image pixels directly when exact composition, small text, proportions, or fine visual details matter.",
  "do_not_infer_note": "Do not infer unseen alternate views, additional props, story state, or acceptance of derivative images beyond what is described here.",
  "image": {
    "repo_image_path": "workbench/issue_48_override_heist_style_framework_v0_3/style-sheets/klause/klause-approved-style-sheet.png",
    "relative_image_path": "klause-approved-style-sheet.png",
    "repo_sidecar_path": "workbench/issue_48_override_heist_style_framework_v0_3/style-sheets/klause/klause-approved-style-sheet-sidecar.json",
    "relative_sidecar_path": "klause-approved-style-sheet-sidecar.json",
    "image_filename": "klause-approved-style-sheet.png",
    "sha256": "735b223f6c47291905f400eef2a7e2bf519e230ee0b249547cdc3097df8563cf",
    "byte_size": 1814974,
    "mime_type": "image/png",
    "dimensions": {
      "width": 1448,
      "height": 1086
    },
    "mode": "RGB",
    "asset_role": "style-sheet",
    "acceptance_state": "approved",
    "inspection_mode": "pixel_inspection",
    "confidence": "high",
    "provenance": {
      "generator": "unknown",
      "model": "unknown",
      "generated_at": null,
      "prompt_language": null,
      "prompt": null,
      "prompt_retained": false,
      "prompt_unretained_note": "Provenance has not been determined for this image."
    }
  },
  "summary": "Approved full style sheet for Klause, the Klause is the decision specialist. He selects the workable route after evidence, pressure testing, authority, and contingency constraints make the option space smaller.. It defines the canonical design, turnaround, action poses, kit/props, material palette, identity locks, and guiding principle.",
  "observed_visual_facts": {
    "layout": [
      "Approved Klause style sheet, multi-panel reference board."
    ],
    "character_design": [],
    "action_utility_poses": [],
    "canonical_kit_props": []
  },
  "positive_constraints": [
    "Klause is a Patch-level autonomous-agent decision specialist. He is German, serious, studious, disciplined, and intolerant of wasted time. He remains at his immaculate desk while Patch pitches with one pitch binder. His accepted hero first-pass visual anchor is a hood-up autonomous agent in a muted office-navy open zip-through hoodie over a crisp white shirt and dark narrow tie, with one antenna, pale grey hands, and a single continuous curved-glass / frosted-screen face surface inside the hood opening. His face screen is the whole face area, including where a human chin would be; eyes and any small mouth mark sit within that same screen. He uses sparse desk props: aligned pen, pitch binder, and possibly a small decision stamp. Klause diagnoses that the plan has too many options and that he has been rejecting them while Patch talks. He realizes the only workable option is where he comes in, says “You son of a gun,” gestures for the pitch binder, does not open it, and stamps the cover “I’M IN.”"
  ],
  "negative_constraints": [
    "Do not make Klause leave his desk, conduct a room traversal, or physically sort task cards. Do not make him a literal human man, military officer, villain, authoritarian boss, angry caricature, animal, Patch clone, Bit/Bot-style robot, generic analyst, human business executive, judge, lawyer, HR manager, or corporate compliance mascot. Do not use national stereotypes, flags, real political symbols, uniforms, weapons, shouting aggression, military coding, or German caricature. Do not make him Writ's authority specialist; his domain is decision selection. Do not give him Patch's teal hoodie, two antennae, crossbody bag, or cheerful protagonist face; Silk's dark stealth hoodie or crawlspace/ninja language; Writ's moustache, tweed, legal props, or legal-office palette; or Rollback's olive bulk and containment-worker proportions. Do not use photorealism, glossy 3D, toy/plastic figurine rendering, over-detailed sci-fi greebles, robot helmet construction, metal jaw/chin plating, a separate chin under the visor, a visor strap around the jaw, black gloves, robot fingers, an overly round bobble head, or a bare sphere with a face painted on it."
  ],
  "sidecar_usage": {
    "best_for": [
      "Canonical Klause design reference.",
      "Turnaround/proportion checks.",
      "Prompt constraints for Klause scenes.",
      "Prop and palette extraction.",
      "QA against character drift."
    ],
    "not_sufficient_for": [
      "Final acceptance of new generated images without image QA.",
      "Precise OCR of every small label if exact wording matters.",
      "Authorizing non-Klause character design changes."
    ],
    "linear_view_route": null,
    "repo_index_tags": [
      "character:klause",
      "asset:style-sheet",
      "state:approved",
      "role:decision",
      "workbench"
    ]
  },
  "created_at": "2026-08-20T18:23:13.641039Z"
}
