{
  "schema": "adventures.visual_sidecar.adjacent.v1",
  "project": "Adventures of Patch",
  "character": "Silk",
  "sidecar_purpose": "Repo-resident semantic image sidecar for Codex/Devin worker selection, visual continuity, QA, and prompt constraint extraction.",
  "source_truth_note": "This sidecar is derived visual evidence for the referenced image. It does not by itself promote the image to canon beyond the acceptance state stated here.",
  "runtime_use_note": "Use this sidecar for ordinary textual selection and continuity work. Inspect the image pixels directly when exact composition, small text, proportions, or fine visual details matter.",
  "do_not_infer_note": "Do not infer unseen alternate views, additional props, story state, or acceptance of derivative images beyond what is described here.",
  "image": {
    "repo_image_path": "workbench/issue_48_override_heist_style_framework_v0_3/style-sheets/silk/silk-approved-hero.png",
    "relative_image_path": "silk-approved-hero.png",
    "repo_sidecar_path": "workbench/issue_48_override_heist_style_framework_v0_3/style-sheets/silk/silk-approved-hero-sidecar.json",
    "relative_sidecar_path": "silk-approved-hero-sidecar.json",
    "image_filename": "silk-approved-hero.png",
    "sha256": "28627c6809a7604dbcff66e46be9f79cf554cfe5c1176efe53ecc3f5c8b223d8",
    "byte_size": 2092861,
    "mime_type": "image/png",
    "dimensions": {
      "width": 1122,
      "height": 1402
    },
    "mode": "RGB",
    "asset_role": "approved-hero",
    "acceptance_state": "approved",
    "inspection_mode": "pixel_inspection",
    "confidence": "high",
    "provenance": {
      "generator": "unknown",
      "model": "unknown",
      "generated_at": null,
      "prompt_language": null,
      "prompt": null,
      "prompt_retained": false,
      "prompt_unretained_note": "Provenance has not been determined for this image."
    }
  },
  "summary": "Approved hero image of Silk, the Silk is the red-team / adversarial pressure-testing specialist. She tests whether Patch's proposed lawful route leaks, contains unsafe shortcuts, or collapses under hostile interpretation.. It is the clearest single-image reference for Silk's demeanor, silhouette, costume, and role.",
  "observed_visual_facts": {
    "composition": [
      "Portrait-oriented hero image of Silk, the red-team."
    ],
    "character_design": [
      "small Patch-scale autonomous-agent body, not human-sized;",
      "compact, stocky, low-centre-of-gravity proportions;",
      "tomboy female read: practical, fitted, slightly curvy, not girly;",
      "oversized but solid grey soft-shell hoodie as the dominant silhouette;",
      "no pale/cream torso costume panel;",
      "no pale/cream cuff detailing as costume language;",
      "darker fitted leg coverings;",
      "sturdy practical grey/dark shoes;"
    ],
    "mood_and_role": [
      "Silk is the red-team / adversarial pressure-testing specialist. She tests whether Patch's proposed lawful route leaks, contains unsafe shortcuts, or collapses under hostile interpretation."
    ],
    "style": [
      "Clean Adventures editorial/vector-adjacent finish with controlled painterly shading."
    ]
  },
  "positive_constraints": [
    "Silk is a small Patch-scale autonomous-agent girl and red-team pressure tester. Her accepted v1 design is the compact grey-hooded Threadline Inspector: compact stocky low-centre-of-gravity body, solid grey soft-shell hoodie as the dominant silhouette, subtly tomboy female fit, darker fitted leg coverings, sturdy grey/dark shoes, pale simple faceplate, calm narrow dark eyes, exactly one antenna, compact red test-thread spool pack, small hook/probe/clamp/chalk/line-tag/field-reader tools, light harness, LINE 07 tag when visible, and quiet careful crouched inspector posture. Red belongs mainly to thread, rigging, anchors, clips, and tiny tool accents, not costume pattern. Preserve the accepted hero shot and approved style sheet unless the task explicitly asks for redesign or alternate state."
  ],
  "negative_constraints": [
    "Do not make Silk a literal spider, animal, monster, horror creature, spider-person, human woman, child in costume, full-sized masked acrobat, superhero, Patch clone, Bit/Bot-style robot, ninja, assassin, vigilante, villain, black-and-red comic hero, red-body superhero, or recognisable third-party costume echo. Do not make her tall, leggy, adult-human, tactical-mannequin, fashion-sheet, or human-scale. Do not add extra arms, mandibles, spider abdomen, spider legs, fangs, horror webbing, predatory menace, web-pattern costume language, giant white superhero eyes, katanas, blades, guns, web-shooter-style devices, tactical assassin styling, or bulky gadget overload. Do not give her two antennae, omit the antenna, use Patch's teal hoodie, Patch's crossbody terminal bag, Patch's `>` symbol, Patch's full silhouette, or Patch's protagonist colour read. Do not add pink trim, flowers, bows, princess/fairy motifs, skirt cues, eyelashes, cute-girl-robot tropes, or girly ornament. Do not add pale/cream torso panels or pale/cream cuff costume detailing; keep the hoodie/body mass solid grey. Do not use the anti-pattern sheet as positive reference."
  ],
  "sidecar_usage": {
    "best_for": [
      "Single-image Silk hero reference.",
      "Face, outfit, and prop continuity.",
      "Prompting Silk hero scenes.",
      "QA for demeanor and ontology."
    ],
    "not_sufficient_for": [
      "Full turnaround; use the Silk-approved style sheet.",
      "Complete prop inventory; use the Silk-approved style sheet.",
      "Anti-pattern checks; use the anti-pattern sheet."
    ],
    "linear_view_route": null,
    "repo_index_tags": [
      "character:silk",
      "asset:approved-hero",
      "state:approved",
      "role:red-team",
      "workbench"
    ]
  },
  "created_at": "2026-08-20T18:23:13.641039Z"
}
