{
  "schema": "adventures.visual_sidecar.adjacent.v1",
  "project": "Adventures of Patch",
  "character": "Writ",
  "sidecar_purpose": "Repo-resident semantic image sidecar for Codex/Devin worker selection, visual continuity, QA, and prompt constraint extraction.",
  "source_truth_note": "This sidecar is derived visual evidence for the referenced image. It does not by itself promote the image to canon beyond the acceptance state stated here.",
  "runtime_use_note": "Use this sidecar for ordinary textual selection and continuity work. Inspect the image pixels directly when exact composition, small text, proportions, or fine visual details matter.",
  "do_not_infer_note": "Do not infer unseen alternate views, additional props, story state, or acceptance of derivative images beyond what is described here.",
  "image": {
    "repo_image_path": "workbench/issue_48_override_heist_style_framework_v0_3/style-sheets/writ/writ-approved-hero.png",
    "relative_image_path": "writ-approved-hero.png",
    "repo_sidecar_path": "workbench/issue_48_override_heist_style_framework_v0_3/style-sheets/writ/writ-approved-hero-sidecar.json",
    "relative_sidecar_path": "writ-approved-hero-sidecar.json",
    "image_filename": "writ-approved-hero.png",
    "sha256": "74daf08c9ec227c90e7cb7bd74bb7148c326a66ca5fe212c5879c92bb787f87a",
    "byte_size": 2285406,
    "mime_type": "image/png",
    "dimensions": {
      "width": 1122,
      "height": 1402
    },
    "mode": "RGB",
    "asset_role": "approved-hero",
    "acceptance_state": "approved",
    "inspection_mode": "pixel_inspection",
    "confidence": "high",
    "provenance": {
      "generator": "unknown",
      "model": "unknown",
      "generated_at": null,
      "prompt_language": null,
      "prompt": null,
      "prompt_retained": false,
      "prompt_unretained_note": "Provenance has not been determined for this image."
    }
  },
  "summary": "Approved hero image of Writ, the Writ is the mandate, lawful authority, scope, and authority-boundary specialist. He prevents the override from becoming trespass with nicer paperwork.. It is the clearest single-image reference for Writ's demeanor, silhouette, costume, and role.",
  "observed_visual_facts": {
    "composition": [
      "Portrait-oriented hero image of Writ, the mandate."
    ],
    "character_design": [
      "compact autonomous-agent body, modestly taller than Patch by only a couple of inches in scale-reference use;",
      "cream or aged-ivory rounded helmet/head casing with a dark green-black faceplate;",
      "one formal antenna rising from the helmet, capped by a small brass/gold ball;",
      "glowing yellow eyes, usually narrowed or judicially skeptical;",
      "prominent brown gentleman's moustache under the faceplate, giving him an older scholarly barrister/clerk persona without making him human;",
      "brown tweed or herringbone three-piece formalwear: long coat, waistcoat, trousers, white shirt, and green tie;",
      "formal leather shoes or brogues, polished and old-fashioned;",
      "white or ivory gloved hands;"
    ],
    "mood_and_role": [
      "Writ is the mandate, lawful authority, scope, and authority-boundary specialist. He prevents the override from becoming trespass with nicer paperwork."
    ],
    "style": [
      "Clean Adventures editorial/vector-adjacent finish with controlled painterly shading."
    ]
  },
  "positive_constraints": [
    "Writ is a Patch-level autonomous-agent mandate and authority specialist. He is an older scholarly gentleman: dry, precise, formally observant, slightly old-world, and procedurally exact. Visually, use the accepted Writ hero lock: cream rounded helmet with one brass-tipped antenna, dark faceplate, narrowed yellow eyes, brown moustache, brown tweed formalwear, green tie, white gloves, WRIT badge, legal-scale insignia, seal stamp, and dark green LEDGERS binder with tabbed records/seals/requests/ledgers/assent contents. His domain is the Office of Lawful Standards: chambers, ledger halls, seal desks, frosted glass doors, walnut, brass, green leather, tea, and secretary support. He stops Patch with “Absolutely not. On whose authority?” then realizes this is why Patch needs him. He says “You sly old bombardier,” writes “I’M IN” on a triplicate receipt pad, distributes all copies properly, and closes the matter."
  ],
  "negative_constraints": [
    "Do not make Writ a literal human man, judge villain, boss, policeman, king, aristocratic tyrant, animal, Patch clone, Bit/Bot-style robot, generic bureaucrat, or Rollback-like bulky containment worker. Do not make him threatening, authoritarian, militarized, police-coded, courtroom-dramatic, or modern tech-office. Do not give him two Patch antennae, teal Patch clothing, Rollback's hooded suit/body mass, or generic robot features. Do not remove the moustache, single brass-tipped antenna, tweed legal-office wardrobe, seal/ledger props, or lawful-standards iconography when producing Writ hero or style-sheet images. Do not have him casually agree; his assent must be formal, copied, filed, and procedurally closed."
  ],
  "sidecar_usage": {
    "best_for": [
      "Single-image Writ hero reference.",
      "Face, outfit, and prop continuity.",
      "Prompting Writ hero scenes.",
      "QA for demeanor and ontology."
    ],
    "not_sufficient_for": [
      "Full turnaround; use the Writ-approved style sheet.",
      "Complete prop inventory; use the Writ-approved style sheet.",
      "Anti-pattern checks; use the anti-pattern sheet."
    ],
    "linear_view_route": null,
    "repo_index_tags": [
      "character:writ",
      "asset:approved-hero",
      "state:approved",
      "role:mandate",
      "workbench"
    ]
  },
  "created_at": "2026-08-20T18:23:13.641039Z"
}
